<?xml version="1.0" encoding="UTF-8"?>
<model version="1.0" uuid="6c84fb90-12c4-11e1-840d-7b25c5ee775a" xmlns:xsi="http://www.w3.org/2001/XMLSchema-instance" xsi:noNamespaceSchemaLocation="schema.xsd">
  <class id="598e6db1-db45-4f98-ab18-0d79174a0d41" x="0" y="0">
    <name>Person</name>
    <attribute visibility="public" type="string">
      Name
    </attribute>
    <attribute visibility="private" type="integer">
      Age
    </attribute>
  </class>
  <class id="68bbd3a7-3bc9-4c09-885e-b278446fbd25" extends="598e6db1-db45-4f98-ab18-0d79174a0d41" x="0" y="100">
    <name>Student</name>
    <attribute visibility="public" type="string">
      Major
    </attribute>
    <operation visibility="protected" returnType="void">
      <name>study</name>
      <arg type="string">
        subject
      </arg>
      <arg type="integer">
        hours
      </arg>
    </operation>
  </class>
  <class id="027e019a-11dc-4fbb-bce8-03b3dc73de9d" x="100" y="100">
    <name>Book</name>
    <attribute visibility="public" type="string" />
  </class>
  <relationship from="68bbd3a7-3bc9-4c09-885e-b278446fbd25" to="027e019a-11dc-4fbb-bce8-03b3dc73de9d" fromMulti="1" toMulti="0..*" type="aggregation">
    has
  </relationship>
</model>